{
  "schema_version": 1,
  "entries": [
    {
      "issued": "2026-09-30",
      "price_at_issue": 85115.0,
      "a": -16.209553,
      "b": 5.602096,
      "horizons": [
        {
          "horizon_days": 30,
          "target_date": "2026-10-30",
          "trend": 142600.17,
          "inner_low": 73325.16,
          "inner_high": 298757.65,
          "floor": 57634.83,
          "ceiling": 755224.45,
          "outcome": {
            "actual_date": "2026-10-30",
            "actual": 77231.0,
            "miss_factor": 0.5416,
            "inside_inner": true,
            "inside_outer": true
          }
        },
        {
          "horizon_days": 90,
          "target_date": "2026-12-29",
          "trend": 150122.0,
          "inner_low": 77192.9,
          "inner_high": 314516.43,
          "floor": 60674.94,
          "ceiling": 795060.8,
          "outcome": null
        },
        {
          "horizon_days": 365,
          "target_date": "2027-09-30",
          "trend": 188895.59,
          "inner_low": 97130.32,
          "inner_high": 395749.9,
          "floor": 76346.09,
          "ceiling": 1000409.52,
          "outcome": null
        },
        {
          "horizon_days": 730,
          "target_date": "2028-09-29",
          "trend": 252716.3,
          "inner_low": 129947.0,
          "inner_high": 529458.9,
          "floor": 102140.56,
          "ceiling": 1338410.23,
          "outcome": null
        },
        {
          "horizon_days": 1461,
          "target_date": "2030-09-30",
          "trend": 434126.04,
          "inner_low": 223228.09,
          "inner_high": 909525.41,
          "floor": 175461.1,
          "ceiling": 2299173.99,
          "outcome": null
        }
      ]
    },
    {
      "issued": "2026-10-01",
      "price_at_issue": 83930.0,
      "a": -16.208972,
      "b": 5.601918,
      "horizons": [
        {
          "horizon_days": 30,
          "target_date": "2026-10-31",
          "trend": 142690.8,
          "inner_low": 73378.86,
          "inner_high": 298923.44,
          "floor": 57668.27,
          "ceiling": 755579.17,
          "outcome": null
        },
        {
          "horizon_days": 90,
          "target_date": "2026-12-30",
          "trend": 150215.99,
          "inner_low": 77248.69,
          "inner_high": 314687.98,
          "floor": 60709.57,
          "ceiling": 795426.67,
          "outcome": null
        },
        {
          "horizon_days": 365,
          "target_date": "2027-10-01",
          "trend": 189006.0,
          "inner_low": 97196.49,
          "inner_high": 395949.3,
          "floor": 76386.49,
          "ceiling": 1000828.31,
          "outcome": null
        },
        {
          "horizon_days": 730,
          "target_date": "2028-09-30",
          "trend": 252851.19,
          "inner_low": 130028.93,
          "inner_high": 529698.82,
          "floor": 102189.44,
          "ceiling": 1338902.65,
          "outcome": null
        },
        {
          "horizon_days": 1461,
          "target_date": "2030-10-01",
          "trend": 434319.23,
          "inner_low": 223349.02,
          "inner_high": 909856.83,
          "floor": 175529.48,
          "ceiling": 2299815.83,
          "outcome": null
        }
      ]
    }
  ],
  "started": "2026-09-30",
  "updated_at": "2026-10-30"
}
